{
  "$schema": "http://json-schema.org/draft-07/schema#",
  "type": "object",
  "required": [
    "$schema",
    "schema_version",
    "network_id",
    "generated_at",
    "source",
    "currency",
    "unit",
    "station_ids",
    "fares"
  ],
  "properties": {
    "$schema": {
      "type": "string"
    },
    "schema_version": {
      "type": "string"
    },
    "network_id": {
      "type": "string"
    },
    "generated_at": {
      "type": "string"
    },
    "source": {
      "type": "array",
      "items": {
        "type": "object",
        "required": [
          "name",
          "url",
          "version",
          "retrieved_at",
          "license",
          "license_url",
          "attribution"
        ],
        "properties": {
          "name": {
            "type": "string"
          },
          "url": {
            "type": "string"
          },
          "version": {
            "type": "string"
          },
          "retrieved_at": {
            "type": "string"
          },
          "license": {
            "type": "string",
            "enum": ["unknown", "cc0", "cc-by", "cc-by-sa", "odbl", "custom"]
          },
          "license_url": {
            "anyOf": [
              {
                "type": "string"
              },
              {
                "type": "null"
              }
            ]
          },
          "attribution": {
            "type": "string"
          },
          "notes": {
            "type": "string"
          }
        },
        "additionalProperties": false
      }
    },
    "currency": {
      "type": "string"
    },
    "unit": {
      "type": "string"
    },
    "basis": {
      "type": "string",
      "enum": ["base"]
    },
    "station_ids": {
      "type": "array",
      "items": {
        "type": "string"
      }
    },
    "fares": {
      "type": "array",
      "items": {
        "type": "array",
        "items": {
          "anyOf": [
            {
              "type": "number"
            },
            {
              "type": "null"
            }
          ]
        }
      }
    }
  },
  "additionalProperties": false
}
