{
  "$schema": "https://schemas.openmetro.dev/v1/fares.schema.json",
  "schema_version": "1.0",
  "network_id": "cn-macau",
  "generated_at": "2026-10-12T11:04:41.513Z",
  "source": [
    {
      "name": "MLM fare rules (station-count tiers)",
      "url": "https://www.mlm.com.mo/tc/general_ticket.html",
      "version": "2026",
      "retrieved_at": "2026-10-12T11:04:41.513Z",
      "license": "unknown",
      "license_url": null,
      "attribution": "澳門輕軌股份有限公司 (Macao Light Rapid Transit Corporation, Limited)",
      "notes": "Fares are a function of station count (sea-crossing = 2 stations; endpoint-only stations not counted when passed through)."
    }
  ],
  "currency": "MOP",
  "unit": "pataca",
  "station_ids": [
    "airport",
    "barra",
    "cotai-east",
    "cotai-west",
    "east-asian-games",
    "hengqin",
    "jockey-club",
    "lotus",
    "must",
    "ocean",
    "pai-kok",
    "seac-pai-van",
    "stadium",
    "taipa-ferry-terminal",
    "union-hospital"
  ],
  "fares": [
    [
      0,
      12,
      6,
      8,
      6,
      8,
      10,
      8,
      6,
      12,
      10,
      8,
      10,
      6,
      8
    ],
    [
      12,
      0,
      10,
      8,
      10,
      10,
      6,
      8,
      12,
      6,
      8,
      10,
      6,
      12,
      10
    ],
    [
      6,
      10,
      0,
      8,
      6,
      8,
      10,
      6,
      6,
      10,
      8,
      6,
      8,
      6,
      6
    ],
    [
      8,
      8,
      8,
      0,
      6,
      6,
      6,
      6,
      8,
      8,
      6,
      6,
      6,
      10,
      6
    ],
    [
      6,
      10,
      6,
      6,
      0,
      6,
      8,
      6,
      6,
      10,
      8,
      6,
      8,
      8,
      6
    ],
    [
      8,
      10,
      8,
      6,
      6,
      0,
      8,
      6,
      8,
      8,
      6,
      6,
      8,
      10,
      6
    ],
    [
      10,
      6,
      10,
      6,
      8,
      8,
      0,
      8,
      10,
      6,
      6,
      8,
      6,
      12,
      8
    ],
    [
      8,
      8,
      6,
      6,
      6,
      6,
      8,
      0,
      8,
      8,
      6,
      6,
      6,
      8,
      6
    ],
    [
      6,
      12,
      6,
      8,
      6,
      8,
      10,
      8,
      0,
      10,
      8,
      8,
      10,
      6,
      6
    ],
    [
      12,
      6,
      10,
      8,
      10,
      8,
      6,
      8,
      10,
      0,
      6,
      10,
      6,
      12,
      8
    ],
    [
      10,
      8,
      8,
      6,
      8,
      6,
      6,
      6,
      8,
      6,
      0,
      8,
      6,
      10,
      6
    ],
    [
      8,
      10,
      6,
      6,
      6,
      6,
      8,
      6,
      8,
      10,
      8,
      0,
      8,
      8,
      6
    ],
    [
      10,
      6,
      8,
      6,
      8,
      8,
      6,
      6,
      10,
      6,
      6,
      8,
      0,
      10,
      8
    ],
    [
      6,
      12,
      6,
      10,
      8,
      10,
      12,
      8,
      6,
      12,
      10,
      8,
      10,
      0,
      8
    ],
    [
      8,
      10,
      6,
      6,
      6,
      6,
      8,
      6,
      6,
      8,
      6,
      6,
      8,
      8,
      0
    ]
  ]
}