{"$schema":"https://raw.githubusercontent.com/Naptie/openmetro/main/schemas/v1/fares.schema.json","schema_version":"1.0","network_id":"cn-taiyuan","generated_at":"2026-10-22T13:59:35.068Z","source":[{"name":"Taiyuan Metro official route planner (busExt)","url":"https://webapi.amap.com/subway/service/navigation/busExt?x1={lon}&y1={lat}&x2={lon}&y2={lat}&poiid1={poiid}&poiid2={poiid}&type=6&Ver=3","version":"2026","retrieved_at":"2026-10-22T13:58:01.925Z","license":"unknown","license_url":null,"attribution":"Taiyuan Metro (太原地铁)","notes":"Ordinary single-journey fare per OD pair from the operator's own route planner (the backend of the 路线查询 page on www.tymetro.ltd). Matches the published distance tariff: 2 元 for the first 5 km, then +1 元 per 5/5/6/6/7 km, no cap. The matrix is harvested via --layer fares."}],"currency":"CNY","unit":"yuan","station_ids":["cn-taiyuan-beiying","cn-taiyuan-changfeng-dongjie","cn-taiyuan-changfeng-jie","cn-taiyuan-chaoyang-jie","cn-taiyuan-dabeimen","cn-taiyuan-dananmen","cn-taiyuan-dianzi-xijie","cn-taiyuan-fuxi-jie","cn-taiyuan-haojiagou","cn-taiyuan-he-longwan","cn-taiyuan-huangling","cn-taiyuan-huazhang-xijie","cn-taiyuan-jiajie","cn-taiyuan-jiancaoping","cn-taiyuan-jianhe","cn-taiyuan-jihuying","cn-taiyuan-jinyang-jie","cn-taiyuan-jinyang-lu","cn-taiyuan-kaihuasi-jie","cn-taiyuan-kangning-jie","cn-taiyuan-liunan","cn-taiyuan-longcheng-gongyuan","cn-taiyuan-longxing-jie","cn-taiyuan-nanneihuan","cn-taiyuan-nanshifang-jie","cn-taiyuan-nanzhonghuan","cn-taiyuan-shenglijie","cn-taiyuan-shuangta","cn-taiyuan-taiyuan-ligong-daxue","cn-taiyuan-taiyuan-nanzhan","cn-taiyuan-taiyuan-zhandong-guangchang","cn-taiyuan-taiyuan-zhanxi-guangchang","cn-taiyuan-taoyuan-lu","cn-taiyuan-tiyuguan","cn-taiyuan-tongda-jie","cn-taiyuan-wangcun-nanjie","cn-taiyuan-wusu-1-hao-2-hao-hangzhanlou","cn-taiyuan-wuyi-guangchang","cn-taiyuan-xiayuan","cn-taiyuan-xike-zhan","cn-taiyuan-ximing-lu","cn-taiyuan-xiqiao","cn-taiyuan-xuefu-dongjie","cn-taiyuan-xuefu-jie","cn-taiyuan-xutan-dongjie","cn-taiyuan-yanjiagou-xiaojingyu-lu"],"fares":[[0,2,5,3,5,4,6,4,3,6,2,6,6,5,5,4,5,5,4,6,4,6,6,4,3,5,5,3,5,2,3,4,4,4,6,5,3,4,5,5,6,7,2,5,2,5],[2,0,4,2,4,3,5,4,3,5,3,5,5,5,4,4,5,5,3,6,3,5,5,4,2,5,4,2,4,2,3,3,3,4,6,4,3,3,4,5,5,6,2,4,2,4],[5,4,0,3,3,2,3,3,3,5,5,4,3,4,3,3,2,4,3,3,3,2,2,2,4,2,3,4,3,5,3,3,3,2,3,2,6,3,3,4,4,4,4,2,5,3],[3,2,3,0,3,2,5,3,2,4,4,5,4,4,3,3,4,4,3,5,2,4,4,3,2,4,3,2,3,3,2,2,3,3,5,3,4,2,3,4,4,6,3,4,3,3],[5,4,3,3,0,2,5,2,3,4,5,5,4,2,2,2,4,4,2,5,2,4,4,3,4,4,2,3,3,4,3,3,2,2,5,3,6,2,3,4,4,5,4,3,4,3],[4,3,2,2,2,0,4,2,2,4,4,5,4,3,3,2,3,3,2,4,2,3,3,2,3,3,2,3,2,4,2,2,2,2,4,2,5,2,2,3,3,5,3,3,4,3],[6,5,3,5,5,4,0,4,5,6,6,2,2,5,5,4,2,5,4,2,4,2,2,3,5,2,5,5,4,6,4,4,4,4,2,3,7,4,5,5,6,3,6,3,6,5],[4,4,3,3,2,2,4,0,2,4,5,5,4,2,2,2,3,3,2,4,2,4,4,2,3,3,2,3,2,4,2,2,2,2,5,2,5,2,3,3,4,5,4,3,4,3],[3,3,3,2,3,2,5,2,0,4,4,5,4,3,3,3,4,4,2,5,2,4,4,3,2,4,3,2,3,3,2,2,2,2,5,3,4,2,3,4,4,5,3,3,3,3],[6,5,5,4,4,4,6,4,4,0,6,6,5,5,5,4,5,2,4,6,4,5,5,4,5,5,4,5,3,6,4,4,3,4,6,4,7,4,3,2,2,7,5,5,6,3],[2,3,5,4,5,4,6,5,4,6,0,6,6,5,5,5,6,6,5,7,4,6,6,5,3,6,5,3,5,2,4,4,5,5,7,5,2,4,5,6,6,7,2,5,2,5],[6,5,4,5,5,5,2,5,5,6,6,0,3,6,5,5,3,5,5,2,5,3,3,4,5,3,5,5,5,6,5,5,5,4,2,4,6,5,5,5,5,2,5,3,6,5],[6,5,3,4,4,4,2,4,4,5,6,3,0,5,5,4,2,5,4,2,4,2,2,3,5,2,4,5,4,6,4,4,4,3,2,3,7,4,4,5,5,3,5,2,5,5],[5,5,4,4,2,3,5,2,3,5,5,6,5,0,2,2,4,4,3,5,3,5,4,3,4,4,2,4,3,5,3,3,3,3,5,3,6,3,4,4,5,6,5,4,5,4],[5,4,3,3,2,3,5,2,3,5,5,5,5,2,0,2,4,4,2,5,3,4,4,3,4,4,2,4,3,5,3,3,3,3,5,3,6,3,3,4,4,6,4,4,5,4],[4,4,3,3,2,2,4,2,3,4,5,5,4,2,2,0,4,3,2,5,2,4,4,2,3,3,2,3,3,4,2,2,2,2,5,3,5,2,3,3,4,5,4,3,4,3],[5,5,2,4,4,3,2,3,4,5,6,3,2,4,4,4,0,4,3,3,3,2,2,3,4,2,4,4,4,5,4,3,3,3,3,2,6,3,4,5,5,3,5,2,5,4],[5,5,4,4,4,3,5,3,4,2,6,5,5,4,4,3,4,0,3,5,3,5,5,3,4,4,4,4,2,5,3,3,3,3,6,3,6,3,2,2,2,6,5,4,5,2],[4,3,3,3,2,2,4,2,2,4,5,5,4,3,2,2,3,3,0,4,2,4,3,2,3,3,2,3,2,4,2,2,2,2,5,2,5,2,3,3,3,5,4,3,4,3],[6,6,3,5,5,4,2,4,5,6,7,2,2,5,5,5,3,5,4,0,4,2,2,4,5,3,5,5,5,6,5,4,4,4,2,3,7,4,5,5,6,2,6,3,6,5],[4,3,3,2,2,2,4,2,2,4,4,5,4,3,3,2,3,3,2,4,0,4,3,2,3,3,2,3,2,4,2,2,2,2,4,2,5,2,2,3,3,5,3,3,3,3],[6,5,2,4,4,3,2,4,4,5,6,3,2,5,4,4,2,5,4,2,4,0,2,3,5,2,4,5,4,6,4,4,4,3,2,3,7,4,4,5,5,3,5,2,5,4],[6,5,2,4,4,3,2,4,4,5,6,3,2,4,4,4,2,5,3,2,3,2,0,3,5,2,4,4,4,5,4,4,3,3,3,3,6,3,4,5,5,3,5,2,5,4],[4,4,2,3,3,2,3,2,3,4,5,4,3,3,3,2,3,3,2,4,2,3,3,0,3,2,3,3,3,4,3,2,2,2,4,2,5,2,3,4,4,4,4,2,4,3],[3,2,4,2,4,3,5,3,2,5,3,5,5,4,4,3,4,4,3,5,3,5,5,3,0,4,4,2,3,2,2,3,3,3,6,4,4,3,4,4,5,6,2,4,2,4],[5,5,2,4,4,3,2,3,4,5,6,3,2,4,4,3,2,4,3,3,3,2,2,2,4,0,4,4,3,5,3,3,3,3,3,2,6,3,4,4,5,3,5,2,5,4],[5,4,3,3,2,2,5,2,3,4,5,5,4,2,2,2,4,4,2,5,2,4,4,3,4,4,0,4,3,5,3,3,3,3,5,3,6,3,3,4,4,6,4,4,4,3],[3,2,4,2,3,3,5,3,2,5,3,5,5,4,4,3,4,4,3,5,3,5,4,3,2,4,4,0,3,3,2,2,3,3,5,3,4,2,4,4,5,6,2,4,2,4],[5,4,3,3,3,2,4,2,3,3,5,5,4,3,3,3,4,2,2,5,2,4,4,3,3,3,3,3,0,4,3,2,2,2,5,3,5,2,2,2,3,5,4,3,4,2],[2,2,5,3,4,4,6,4,3,6,2,6,6,5,5,4,5,5,4,6,4,6,5,4,2,5,5,3,4,0,3,3,4,4,6,4,3,4,5,5,5,7,2,5,2,5],[3,3,3,2,3,2,4,2,2,4,4,5,4,3,3,2,4,3,2,5,2,4,4,3,2,3,3,2,3,3,0,2,2,2,5,3,5,2,3,4,4,5,3,3,3,3],[4,3,3,2,3,2,4,2,2,4,4,5,4,3,3,2,3,3,2,4,2,4,4,2,3,3,3,2,2,3,2,0,2,2,5,3,5,2,3,3,4,5,3,3,3,3],[4,3,3,3,2,2,4,2,2,3,5,5,4,3,3,2,3,3,2,4,2,4,3,2,3,3,3,3,2,4,2,2,0,2,5,2,5,2,2,3,3,5,4,3,4,2],[4,4,2,3,2,2,4,2,2,4,5,4,3,3,3,2,3,3,2,4,2,3,3,2,3,3,3,3,2,4,2,2,2,0,4,2,5,2,3,3,4,5,4,2,4,3],[6,6,3,5,5,4,2,5,5,6,7,2,2,5,5,5,3,6,5,2,4,2,3,4,6,3,5,5,5,6,5,5,5,4,0,4,7,5,5,6,6,2,6,3,6,5],[5,4,2,3,3,2,3,2,3,4,5,4,3,3,3,3,2,3,2,3,2,3,3,2,4,2,3,3,3,4,3,3,2,2,4,0,6,2,3,4,4,4,4,2,4,3],[3,3,6,4,6,5,7,5,4,7,2,6,7,6,6,5,6,6,5,7,5,7,6,5,4,6,6,4,5,3,5,5,5,5,7,6,0,5,6,6,7,8,3,6,3,6],[4,3,3,2,2,2,4,2,2,4,4,5,4,3,3,2,3,3,2,4,2,4,3,2,3,3,3,2,2,4,2,2,2,2,5,2,5,0,3,3,4,5,3,3,3,3],[5,4,3,3,3,2,5,3,3,3,5,5,4,4,3,3,4,2,3,5,2,4,4,3,4,4,3,4,2,5,3,3,2,3,5,3,6,3,0,2,2,6,4,4,4,2],[5,5,4,4,4,3,5,3,4,2,6,5,5,4,4,3,5,2,3,5,3,5,5,4,4,4,4,4,2,5,4,3,3,3,6,4,6,3,2,0,2,6,5,4,5,2],[6,5,4,4,4,3,6,4,4,2,6,5,5,5,4,4,5,2,3,6,3,5,5,4,5,5,4,5,3,5,4,4,3,4,6,4,7,4,2,2,0,6,5,5,5,2],[7,6,4,6,5,5,3,5,5,7,7,2,3,6,6,5,3,6,5,2,5,3,3,4,6,3,6,6,5,7,5,5,5,5,2,4,8,5,6,6,6,0,6,4,7,6],[2,2,4,3,4,3,6,4,3,5,2,5,5,5,4,4,5,5,4,6,3,5,5,4,2,5,4,2,4,2,3,3,4,4,6,4,3,3,4,5,5,6,0,5,2,4],[5,4,2,4,3,3,3,3,3,5,5,3,2,4,4,3,2,4,3,3,3,2,2,2,4,2,4,4,3,5,3,3,3,2,3,2,6,3,4,4,5,4,5,0,5,4],[2,2,5,3,4,4,6,4,3,6,2,6,5,5,5,4,5,5,4,6,3,5,5,4,2,5,4,2,4,2,3,3,4,4,6,4,3,3,4,5,5,7,2,5,0,5],[5,4,3,3,3,3,5,3,3,3,5,5,5,4,4,3,4,2,3,5,3,4,4,3,4,4,3,4,2,5,3,3,2,3,5,3,6,3,2,2,2,6,4,4,5,0]]}
