{
  "$schema": "https://raw.githubusercontent.com/Naptie/openmetro/main/schemas/v1/fares.schema.json",
  "schema_version": "1.0",
  "network_id": "cn-lanzhou",
  "generated_at": "2026-10-22T21:01:07.380Z",
  "source": [
    {
      "name": "兰州轨道交通票价查询矩阵（官网静态资产 fareData.js）",
      "url": "https://www.lzgdjt.com/lzgd/template/js/fareData.js",
      "version": "2026-10",
      "license": "unknown",
      "license_url": null,
      "attribution": "兰州市轨道交通有限公司",
      "retrieved_at": "2026-10-22T21:01:07.380Z",
      "notes": "OD 票价直接取自官网静态资产 fareData.js 的 window.fareData 矩阵（27 起点 × 26 终点 = 702 个单元，对称、无缺值、2–7 元）。官网线上「票价查询」由 fareUtil.js 覆写 webPost.getRoute 后在客户端读取同一份矩阵，故该矩阵即运营方现行票价源；官网公布的里程分段计价（起步 2 元/4 公里，晋级里程 4、4、6、6、8、8，40 公里以上每加 1 元多乘 8 公里）与该矩阵逐带吻合。官网后端 /tb/search 已停用（502），不予采用。"
    }
  ],
  "currency": "CNY",
  "unit": "yuan",
  "station_ids": [
    "cn-lanzhou-aoti-zhongxin",
    "cn-lanzhou-chenguanying",
    "cn-lanzhou-dongfanghong-guangchang",
    "cn-lanzhou-donggang",
    "cn-lanzhou-gongxingdun",
    "cn-lanzhou-hongxing-xiang",
    "cn-lanzhou-jiaojiawan",
    "cn-lanzhou-junjiatan",
    "cn-lanzhou-lanzhou-chengshi-xueyuan",
    "cn-lanzhou-lanzhou-daxue",
    "cn-lanzhou-lanzhou-haiguan",
    "cn-lanzhou-lanzhou-huochezhan",
    "cn-lanzhou-lanzhou-xizhan-bei-guangchang",
    "cn-lanzhou-matan",
    "cn-lanzhou-qilihe",
    "cn-lanzhou-sheng-qixiangju",
    "cn-lanzhou-shengzhengfu",
    "cn-lanzhou-tuanjie-xincun",
    "cn-lanzhou-tumendun",
    "cn-lanzhou-wenhuagong",
    "cn-lanzhou-wuli-pu",
    "cn-lanzhou-xiaoxihu",
    "cn-lanzhou-xiguan",
    "cn-lanzhou-xizhan-shizi",
    "cn-lanzhou-yanbai-daqiao",
    "cn-lanzhou-youdian-dalou",
    "cn-lanzhou-zhangsutan"
  ],
  "fares": [
    [
      0,
      2,
      5,
      6,
      6,
      6,
      6,
      6,
      2,
      6,
      2,
      6,
      4,
      3,
      4,
      6,
      5,
      6,
      3,
      5,
      6,
      5,
      5,
      4,
      6,
      6,
      6
    ],
    [
      2,
      0,
      6,
      7,
      6,
      6,
      7,
      6,
      2,
      6,
      3,
      6,
      4,
      3,
      5,
      6,
      5,
      6,
      4,
      5,
      6,
      5,
      5,
      4,
      6,
      6,
      6
    ],
    [
      5,
      6,
      0,
      3,
      3,
      2,
      3,
      3,
      5,
      2,
      5,
      2,
      4,
      4,
      3,
      3,
      2,
      2,
      4,
      2,
      2,
      3,
      2,
      3,
      3,
      2,
      2
    ],
    [
      6,
      7,
      3,
      0,
      2,
      3,
      2,
      3,
      6,
      3,
      6,
      3,
      5,
      6,
      5,
      2,
      4,
      3,
      5,
      4,
      3,
      4,
      4,
      5,
      3,
      4,
      3
    ],
    [
      6,
      6,
      3,
      2,
      0,
      3,
      2,
      2,
      6,
      2,
      6,
      3,
      5,
      5,
      4,
      2,
      3,
      3,
      5,
      4,
      2,
      4,
      3,
      4,
      3,
      3,
      2
    ],
    [
      6,
      6,
      2,
      3,
      3,
      0,
      3,
      2,
      5,
      2,
      5,
      2,
      4,
      5,
      4,
      2,
      2,
      2,
      5,
      3,
      2,
      3,
      3,
      4,
      3,
      2,
      2
    ],
    [
      6,
      7,
      3,
      2,
      2,
      3,
      0,
      3,
      6,
      3,
      6,
      3,
      5,
      5,
      5,
      2,
      4,
      3,
      5,
      4,
      2,
      4,
      4,
      5,
      3,
      3,
      3
    ],
    [
      6,
      6,
      3,
      3,
      2,
      2,
      3,
      0,
      6,
      2,
      5,
      3,
      5,
      5,
      4,
      2,
      3,
      2,
      5,
      4,
      2,
      4,
      3,
      4,
      2,
      3,
      2
    ],
    [
      2,
      2,
      5,
      6,
      6,
      5,
      6,
      6,
      0,
      5,
      2,
      5,
      3,
      2,
      4,
      6,
      5,
      5,
      3,
      4,
      5,
      4,
      4,
      3,
      6,
      6,
      5
    ],
    [
      6,
      6,
      2,
      3,
      2,
      2,
      3,
      2,
      5,
      0,
      5,
      2,
      4,
      5,
      3,
      2,
      2,
      2,
      4,
      3,
      2,
      3,
      2,
      4,
      3,
      2,
      2
    ],
    [
      2,
      3,
      5,
      6,
      6,
      5,
      6,
      5,
      2,
      5,
      0,
      5,
      3,
      2,
      3,
      5,
      4,
      5,
      3,
      4,
      5,
      4,
      4,
      3,
      6,
      6,
      5
    ],
    [
      6,
      6,
      2,
      3,
      3,
      2,
      3,
      3,
      5,
      2,
      5,
      0,
      4,
      5,
      4,
      2,
      2,
      2,
      4,
      3,
      2,
      3,
      3,
      4,
      3,
      2,
      2
    ],
    [
      4,
      4,
      4,
      5,
      5,
      4,
      5,
      5,
      3,
      4,
      3,
      4,
      0,
      2,
      2,
      5,
      3,
      5,
      2,
      3,
      4,
      3,
      3,
      2,
      5,
      4,
      5
    ],
    [
      3,
      3,
      4,
      6,
      5,
      5,
      5,
      5,
      2,
      5,
      2,
      5,
      2,
      0,
      3,
      5,
      4,
      5,
      2,
      3,
      5,
      3,
      4,
      3,
      5,
      5,
      5
    ],
    [
      4,
      5,
      3,
      5,
      4,
      4,
      5,
      4,
      4,
      3,
      3,
      4,
      2,
      3,
      0,
      4,
      3,
      4,
      2,
      2,
      4,
      2,
      2,
      2,
      4,
      3,
      4
    ],
    [
      6,
      6,
      3,
      2,
      2,
      2,
      2,
      2,
      6,
      2,
      5,
      2,
      5,
      5,
      4,
      0,
      3,
      2,
      5,
      3,
      2,
      4,
      3,
      4,
      3,
      3,
      2
    ],
    [
      5,
      5,
      2,
      4,
      3,
      2,
      4,
      3,
      5,
      2,
      4,
      2,
      3,
      4,
      3,
      3,
      0,
      3,
      3,
      2,
      3,
      2,
      2,
      3,
      3,
      2,
      3
    ],
    [
      6,
      6,
      2,
      3,
      3,
      2,
      3,
      2,
      5,
      2,
      5,
      2,
      5,
      5,
      4,
      2,
      3,
      0,
      5,
      3,
      2,
      3,
      3,
      4,
      2,
      2,
      2
    ],
    [
      3,
      4,
      4,
      5,
      5,
      5,
      5,
      5,
      3,
      4,
      3,
      4,
      2,
      2,
      2,
      5,
      3,
      5,
      0,
      3,
      5,
      3,
      3,
      2,
      5,
      4,
      5
    ],
    [
      5,
      5,
      2,
      4,
      4,
      3,
      4,
      4,
      4,
      3,
      4,
      3,
      3,
      3,
      2,
      3,
      2,
      3,
      3,
      0,
      3,
      2,
      2,
      2,
      4,
      3,
      3
    ],
    [
      6,
      6,
      2,
      3,
      2,
      2,
      2,
      2,
      5,
      2,
      5,
      2,
      4,
      5,
      4,
      2,
      3,
      2,
      5,
      3,
      0,
      3,
      3,
      4,
      2,
      2,
      2
    ],
    [
      5,
      5,
      3,
      4,
      4,
      3,
      4,
      4,
      4,
      3,
      4,
      3,
      3,
      3,
      2,
      4,
      2,
      3,
      3,
      2,
      3,
      0,
      2,
      2,
      4,
      3,
      4
    ],
    [
      5,
      5,
      2,
      4,
      3,
      3,
      4,
      3,
      4,
      2,
      4,
      3,
      3,
      4,
      2,
      3,
      2,
      3,
      3,
      2,
      3,
      2,
      0,
      3,
      3,
      2,
      3
    ],
    [
      4,
      4,
      3,
      5,
      4,
      4,
      5,
      4,
      3,
      4,
      3,
      4,
      2,
      3,
      2,
      4,
      3,
      4,
      2,
      2,
      4,
      2,
      3,
      0,
      5,
      4,
      4
    ],
    [
      6,
      6,
      3,
      3,
      3,
      3,
      3,
      2,
      6,
      3,
      6,
      3,
      5,
      5,
      4,
      3,
      3,
      2,
      5,
      4,
      2,
      4,
      3,
      5,
      0,
      3,
      2
    ],
    [
      6,
      6,
      2,
      4,
      3,
      2,
      3,
      3,
      6,
      2,
      6,
      2,
      4,
      5,
      3,
      3,
      2,
      2,
      4,
      3,
      2,
      3,
      2,
      4,
      3,
      0,
      3
    ],
    [
      6,
      6,
      2,
      3,
      2,
      2,
      3,
      2,
      5,
      2,
      5,
      2,
      5,
      5,
      4,
      2,
      3,
      2,
      5,
      3,
      2,
      4,
      3,
      4,
      2,
      3,
      0
    ]
  ]
}